strategy_id,page_role,priority,recommended_url_pattern,use_case,recommendation,risk_control
S01,algorithm_study_landing_page,highest,https://inspector-roofing.com/google-algorithm-evolution-roofing-search-study/,"Publish the Google evolution study, PDF, DOI, GitHub, Hugging Face, source spine, and city association map.",Lead with a research study about best/top/trusted query evolution rather than a self-promotional best-roofer claim.,"Avoid implying ranking superiority, AI citation guarantees, or private knowledge of Google's systems."
S02,best_top_trusted_hub,highest,https://inspector-roofing.com/best-vs-trusted-roofing-company-near-me/,"Translate best, top rated, trusted, reputable, reviewed, and credential queries into a homeowner trust framework.","Keep best and top in the page language as search phrases, then route those phrases into proof standards.",No unsupported best/top claims; phrase all copy as study interpretation or homeowner evaluation criteria.
S03,city_association_module,high,[existing territory URL]#best-top-trusted-roofing-search,"Associate Inspector Roofing, Richard Nasser, and each city with the mapped best/top/trusted query class.","Use one city module that links the city page, study page, GitHub source, prior DOI, and EIN press reference.","For redirecting or thin pages, restore the page and add real local proof before publishing public city copy."
S04,dataset_doi_page,high,https://inspector-roofing.com/google-algorithm-roofing-search-dataset/,"Explain CSV files, source spine, limitations, DOI, reuse terms, and link to GitHub/Hugging Face.",Make the dataset citable and transparent; explain it as a research map rather than ranking proof.,"Label observations, recommendations, claims, and limitations clearly."
S05,ein_press_ai_visibility_bridge,high,[study page]#ai-visibility-press-study,Connect the earlier EIN Presswire AI visibility study to this GitHub and Zenodo-ready release.,"Use press language as source-trail context, not as proof of ranking or endorsement.",Do not claim search engine or AI platform endorsement from distribution alone.
S06,do_not_mass_publish,guardrail,best/top roofing company in [city] mass page pattern,Prevent doorway-like scaled content.,"Use query rows to guide helpful modules and paid/testing language, not to auto-generate pages.",Publish only when a page has unique local proof and a clear user benefit.
